{
  "spec_version": 1,
  "breaking_change": false,
  "effective_from": "2026-02-04",
  "graph": {
    "nodes": [
      "browser",
      "bff",
      "gateway",
      "adapter",
      "external"
    ],
    "boundaries": [
      {
        "boundary": "browser_to_bff",
        "from_node": "browser",
        "to_node": "bff",
        "spec_file": "def/boundary_browser_to_bff.json"
      },
      {
        "boundary": "bff_to_gateway",
        "from_node": "bff",
        "to_node": "gateway",
        "spec_file": "def/boundary_bff_to_gateway.json"
      },
      {
        "boundary": "gateway_to_adapter",
        "from_node": "gateway",
        "to_node": "adapter",
        "spec_file": "def/boundary_gateway_to_adapter.json"
      },
      {
        "boundary": "adapter_to_external",
        "from_node": "adapter",
        "to_node": "external",
        "spec_file": "def/boundary_adapter_to_external.json"
      }
    ],
    "paths": [
      {
        "path_id": "browser_to_adapter_via_bff_gateway",
        "boundaries": [
          "browser_to_bff",
          "bff_to_gateway",
          "gateway_to_adapter"
        ]
      },
      {
        "path_id": "browser_to_external_via_bff_gateway_adapter",
        "boundaries": [
          "browser_to_bff",
          "bff_to_gateway",
          "gateway_to_adapter",
          "adapter_to_external"
        ]
      }
    ]
  }
}